Date,BA
4/16/19,eu issues 20 bln list of us imports for tariffs in boeing case 20190
4/16/19,lessors rush to repossess more jet airways planes even as emergency funds awaited 20190
4/16/19,embraers e195 e2 is ready to fly 
4/16/19,etihad group cfo departs as carrier pursues turnaround plan 20190
4/16/19,boeing ba outpaces stock market gains what you should know 
4/16/19,market close report nasdaq composite index closes above 8000 up 2422 points at 800023 
4/16/19,dow closes higher on big boeing finish 
4/16/19,united airlines firstquarter profit rises holds 2019 target 20190
4/16/19,united airlines beats firstquarter profit estimate holds 2019 target 20190
4/16/19,boeing 737 max software upgrade operationally suitable  faa panel 20190
4/16/19,faa panel finds boeing 737 max software upgrade operationally suitable 20190
4/16/19,kenyan family files lawsuit against boeing over ethiopian airlines crash 20190
4/16/19,us manufacturing mired in soft patch in first quarter 20190
4/16/19,china forms task force to review design changes to boeing 737 max 20190
4/16/19,ge stocks latest plunge is another buying opportunity 
4/15/19,lackluster bank earnings pressure us markets 
4/15/19,boeing secures 14b deal for modernizing b 1 amp b 52 bombers 
4/15/19,us stockswall street slips as bank earnings disappoint 20190
4/15/19,wall street slips as bank earnings disappoint 20190
4/15/19,us stocksfinancials drag on wall st as bank results underwhelm 20190
4/15/19,financials drag on wall st as bank results underwhelm 20190
4/15/19,this is why boeing ba is a great dividend stock 
4/15/19,wall street drops after tepid big bank results 20190
4/15/19,us stockswall street drops after tepid big bank results 20190
4/15/19,the math shows ppa can go to 66 
4/15/19,us stocks on the movegoldman boeing biopath alliance data match group 20190
4/15/19,european shares hit by us tariff threat growth jitters april 9 20190
4/15/19,us stockswall street slips as big bank results disappoint 20190
4/15/19,wall street slips as big bank results disappoint 20190
4/15/19,wall street dips after lackluster big bank earnings 20190
4/15/19,us stockswall street dips after lackluster big bank earnings 20190
4/15/19,us stocks on the movelevi strauss aphria western digital spotify 20190
4/15/19,us stockswall st set for muted open as big bank earnings fail to impress 20190
4/15/19,wall st set for muted open as big bank earnings fail to impress 20190
4/15/19,futures muted ahead of big bank earnings 20190
4/15/19,us stocksfutures muted ahead of big bank earnings 20190
4/15/19,trump urges rebrand of 737 max boeing has other ideas 20190
4/15/19,boeing brainstorms to regain trust in max trump urges rebranding 20190
4/15/19,trump says boeing should fix rebrand grounded 737 max jet 20190
4/15/19,trump urges boeing to fix rebrand grounded 737 max planes 20190
4/14/19,alaska airlines may order a ton of boeing 737 max jets in 2019 
4/14/19,should we blame marijuana for a 14 year high in positive work related drug tests 
4/14/19,3 top defense stocks to watch in april 
4/14/19,too many travelers too few planes is us airlines 737 max summer dilemma 20190
4/13/19,boeing crushes airbus on q1 aircraft orders despite 737 max fiasco 
4/13/19,better buy general electric vs boeing 
4/12/19,noteworthy friday option activity ba nssc bhvn 
4/12/19,us stockssp 500 closes near record high as earnings season begins in earnest 20190
4/12/19,sp 500 closes near record high as earnings season begins in earnest 20190
4/12/19,sp 500 climbs to near record high as earnings season shifts to high gear 20190
4/12/19,us stockssp 500 climbs to near record high as earnings season shifts to high gear 20190
4/12/19,defense stock roundup bas 737 crash drags indices down noc scores big 
4/12/19,wall st week aheadindustrials gains put to test as earnings ramp up 20190
4/12/19,faa meets with us airlines pilot unions on boeing 737 max 20190
4/12/19,boeing q1 defense deliveries up on high ah 64 apache demand 
4/12/19,eu tariffs to target 20 billion euros of us imports  diplomats 20190
4/12/19,eu eyes 20 billion euros of us imports to hit over boeing  diplomats 20190
4/12/19,eu draws up list of 20 bln euros of us imports to hit over boeing  diplomats 20190
4/12/19,cufflinks and the caribbean how virgin galactic kept space tourists interest and money 20190
4/12/19,indias spicejet to lease 16 boeing 737s to fill gap as groundings push up fares 20190
4/11/19,elon musks spacex sends worlds most powerful rocket on first commercial flight 20190
4/11/19,market close report nasdaq composite index closes at 794736 down 1688 points 
4/11/19,stocks close mixed with corporate earnings ahead 
4/11/19,15 safe dividend stocks to buy for the rest of 2019 
4/11/19,boeing ceo says 737 max software update working as designed 20190
4/11/19,boeing ceo says two thirds of max customers have seen software fix 20190
4/11/19,boeing ceo says two thirds of max customers have tested software fix 20190
4/11/19,xli ba mmm unp etf inflow alert 
4/11/19,faa to meet with us airlines pilot unions on boeing 737 max 20190
4/11/19,dow movers csco jpm 
4/11/19,refileus stockswall st treads water ahead of big bank earnings 20190
4/11/19,wall st treads water ahead of big bank earnings 20190
4/11/19,us stockswall st treads water ahead of big bank earnings 20190
4/11/19,eu clears way for start of formal trade talks with us 20190
4/11/19,new airbus ceo charts modernisation path under leaner management 20190
4/11/19,new airbus ceo takes charge with leaner structure 20190
4/11/19,koreas air premia selects rollsroyces trent 1000 engines to power dreamliners 20190
4/10/19,boeing ba stock sinks as market gains what you should know 
4/10/19,market close report nasdaq composite index closes at 796424 up 5496 points 
4/10/19,close update stocks post gains as real estate technology sectors pace sp 500 
4/10/19,stocks muscle higher on dovish fed 
4/10/19,mid day update major us stock market indexes mostly advance in modest climb as dow slips 
4/10/19,boeing q1 commercial deliveries down on low 737 jet demand 
4/10/19,wall st ekes out gains as investors shrug off fed minutes 20190
4/10/19,us stockswall st ekes out gains as investors shrug off fed minutes 20190
4/10/19,agree to purchase boeing co at 260 earn 53 using options 
4/10/19,sp nasdaq edge higher as wall st shrugs off fed minutes 20190
4/10/19,us stockssp nasdaq edge higher as wall st shrugs off fed minutes 20190
4/10/19,dow movers ba nke 
4/10/19,economic and earnings data deluge 
4/10/19,delta dal tops estimates cpi in line at 04 
4/10/19,delta dal tops estimates cpi in line at 041 
4/10/19,stock market news for apr 10 2019 
4/10/19,stocks to gain from hypersonic flight technology 
4/10/19,wair vs ba which stock should value investors buy now 
4/10/19,us stockssp 500 nasdaq edge higher on tech gains fed minutes awaited 20190
4/10/19,sp 500 nasdaq edge higher on tech gains fed minutes awaited 20190
4/10/19,us transport chief defends faa decision to not immediately ground boeing 737 max 20190
4/10/19,airbus names ex deutsche telekom boss as next chairman 20190
4/10/19,germany sees 886 bln euro cost to operate tornado jets to 2030 20190
4/10/19,us stocks on the movelevi strauss tesla kroger fox 20190
4/10/19,stocks us dollar inch higher on ecb stance 20190
4/10/19,us stockstech lifts sp 500 nasdaq ahead of fed minutes boeing pressures dow 20190
4/10/19,tech lifts sp 500 nasdaq ahead of fed minutes boeing pressures dow 20190
4/10/19,crashed japanese f35 wreckage found in pacific pilot still missing 20190
4/10/19,sp 500 flat ahead of fed minutes 20190
4/10/19,us stockssp 500 flat ahead of fed minutes 20190
4/10/19,jet hits more turbulence as fleet shrinks and fuel terms tightened 20190
4/10/19,virgin atlantic posts annual loss for second year running 20190
4/10/19,airbusboeing trade war would benefit chinese planemaker france says 20190
4/10/19,rollsroyce agrees to early inspection of problematic trent engines 20190
4/10/19,rollsroyce agrees early inspections for trent engine blades 20190
4/9/19,tariff troubles drag dow sp snaps win streak 
4/9/19,boeing shareholders sue over 737 max crashes disclosures 20190
4/9/19,us stockswall st drops on us trade tensions with eu imf global outlook 20190
4/9/19,wall st drops on us trade tensions with eu imf global outlook 20190
4/9/19,the zacks analyst blog highlights boeing united technologies and embraer 
4/9/19,commercial border delays hit auto industry1 
4/9/19,us yields fall on trade global growth worries 20190
4/9/19,refileus stockswall st falls on renewed trade tensions slowdown angst 20190
4/9/19,spirit aerosystems up on regular investments amid cost woes 
4/9/19,dow movers cat dis 
4/9/19,wall st falls on renewed trade tensions slowdown angst 20190
4/9/19,boeing secures 9m air force deal to modify f 15 program 
4/9/19,auto industry hit by us mexico border dispute 
4/9/19,commercial border delays hit auto industry 
4/9/19,dual downgrades tank boeing stock 
4/9/19,us stocks on the moveboeing wynn resorts unitedhealth walt disney 20190
4/9/19,us stockswall street falls as trade global growth concerns resurface 20190
4/9/19,wall street falls as trade global growth concerns resurface 20190
4/9/19,tuesdays vital data new age beverages boeing and roku 
4/9/19,us stocks on the moveapple boeing wynn resorts unitedhealth cigna 20190
4/9/19,boeing records zero new max orders following global groundings 20190
4/9/19,boeing quarterly orders halve deliveries fall 19 pct on max groundings 20190
4/9/19,european shares hit by us tariff threat growth jitters 20190
4/9/19,wall street falls on worries over trade global growth 20190
4/9/19,us stockswall street falls on worries over trade global growth 20190
4/9/19,share rally cools as trump turns trade heat on europe 20190
4/9/19,boeing 737 max debacle forces a temporary production cut 
4/9/19,boeing quarterly orders halve deliveries tumble on 737 max grounding 20190
4/9/19,us stocks on the moveapple facebook boeing wynn resorts 20190
4/9/19,boeing deliveries sink in first quarter after 737 max groundings 20190
4/9/19,us stockswall street lower as growth worries resurface 20190
4/9/19,wall street lower as growth worries resurface 20190
4/9/19,in new attack trump threatens more tariffs against european union 20190
4/9/19,the downfall of jet airways how indias premium airline crumbled 20190
4/9/19,trump europe ramp up tariff threats in aircraft dispute 20190
4/9/19,brazils embraer names executive of bus maker marcopolo as ceo 20190
4/9/19,us stocks on the movezogenix walt disney boeing simply good foods co 20190
4/9/19,wall st to open lower on trade earnings worries 20190
4/9/19,us stockswall st to open lower on trade earnings worries 20190
4/9/19,american trims quarterly revenue forecast on grounded jets total cost unknown 20190
4/9/19,american airlines trims quarterly revenue forecast shares fall 3 pct 20190
4/9/19,american airlines trims quarterly unit revenue forecast shares fall 3 pct 20190
4/9/19,american airlines trims firstquarter forecast for unit revenue 20190
4/9/19,american airlines cuts firstquarter forecast for unit revenue 20190
4/9/19,futures point to flat opening on wall street 20190
4/9/19,us stocksfutures point to flat opening on wall street 20190
4/9/19,major air regulators to join faas review panel on boeings 737 max 20190
4/9/19,china to join faas review panel on boeings 737 max 20190
4/9/19,eu plans for own retaliation in aircraft dispute with us 20190
4/9/19,tariff threats global growth jitters trip up britains main index 20190
4/9/19,airbus says us sanctions on its aircraft would have no legal basis 20190
4/9/19,airbus says it sees no legal basis for us move to impose sanctions 20190
4/9/19,the worst mistake boeing investors can make right now 
4/9/19,china aircraft leasing says no change to boeing 737 max order 20190
4/8/19,china aircraft leasing says has not put boeing 737 max order on hold 20190
4/8/19,heres why boeing shares were down on monday 
4/8/19,market close report nasdaq composite index closes at 795388 up 1519 points 
4/8/19,how flawed software high speed other factors doomed an ethiopian airlines 737 max 20190
4/8/19,why bp prudhoe bay spirit aerosystems holdings and roku slumped today 
4/8/19,boeing drags on dow sp extends win streak 
4/8/19,close update nasdaq sp 500 turn positive in late day trading monday as dow ends lower 
4/8/19,us proposes list of eu goods for tariff retaliation against airbus subsidies 20190
4/8/19,delta stock is gaining altitude heading into earnings 
4/8/19,what boeing exclusivity means for southwest these days 
4/8/19,southwest airlines slashes its guidance after 737 max groundings 
4/8/19,how long will the boeing 737 max stay grounded 
4/8/19,us stockssp 500 nasdaq edge higher as earnings season looms 20190
4/8/19,sp 500 nasdaq edge higher as earnings season looms 20190
4/8/19,mid day update us stocks slip monday taking a pause after last weeks surge 
4/8/19,dow analyst moves ba 
4/8/19,sp 500 movers ge symc 
4/8/19,dow movers ba pg 
4/8/19,american airlines extends 737 max grounding tenure as well 
4/8/19,will boeings ba 737 max production cut benefit airbus 
4/8/19,disney to enter streaming video market 
4/8/19,industrials weigh on wall st as earnings season looms 20190
4/8/19,us stocksindustrials weigh on wall st as earnings season looms 20190
4/8/19,american keeps 737 max grounded disney preview 
4/8/19,company news for apr 8 2019 
4/8/19,the zacks analyst blog highlights boeing lockheed martin and anthem 
4/8/19,amazon to foray into broadband space with project kuiper 
4/8/19,us stocks on the moveboeing wynn resorts ge micron 20190
4/8/19,wall street stalls on boeing slide earnings jitters 20190
4/8/19,us stockswall street stalls on boeing slide earnings jitters 20190
4/8/19,european shares dip banks and boeing suppliers in focus 20190
4/8/19,londons bluechips end higher aided by oil majors 20190
4/8/19,pre market most active for apr 8 2019 ge chl snap fdc vsm amd ba sqqq roku fisv tsla tvix 
4/8/19,wall street rally stalls on boeing slide earnings jitters 20190
4/8/19,us stockswall street rally stalls on boeing slide earnings jitters 20190
4/8/19,stocks mostly flat on profit concerns oil gains 20190
4/8/19,us stocks on the moveboeing wynn resorts general electric snap 20190
4/8/19,us stocksboeing woes earnings anxiety push wall street lower 20190
4/8/19,boeing woes earnings anxiety push wall street lower 20190
4/8/19,us stockswall st set to open lower on earnings anxiety boeing woes 20190
4/8/19,wall st set to open lower on earnings anxiety boeing woes 20190
4/8/19,us stocks on the moveboeing wynn resorts general electric micron 20190
4/8/19,china aircraft leasing suspends orders for 100 boeing 737 maxs 20190
4/8/19,us stocksfutures subdued as investors brace for tepid earnings season 20190
4/8/19,futures subdued as investors brace for tepid earnings season 20190
4/8/19,tech boeing suppliers drag european shares lower 20190
4/8/19,uk shares dip as boeing 737 output cut bruises industrials 20190
4/8/19,londons ftse 100 dips industrials weak after boeing 737 output cut 20190
4/8/19,scandalprone korean air chairman dies weeks after board ouster 20190
4/8/19,scandalprone korean air chairman dies weeks after ouster from board 20190
4/7/19,how flawed software and excess speed doomed an ethiopian airlines 737 max 20190
4/6/19,heres what to expect from delta air lines dal q1 2019 earnings 
4/6/19,market close report nasdaq composite index closes at 793869 up 4691 points 
4/6/19,top stock reports for boeing lockheed martin anthem 
4/6/19,noteworthy friday option activity goog ba cost 
4/6/19,boeing cuts 737 max output in wake of two deadly crashes 20190
4/6/19,boeing stock already is on its way back after the 737 max debacle 
4/6/19,us stockssp posts 7day winning streak as jobs data allay economic fears 20190
4/6/19,sp posts 7day winning streak as jobs data allay economic fears 20190
4/6/19,stock market news boeing takes blame aurora cannabis gets a win in germany 
4/6/19,wall street rises as jobs data allay economic concerns 20190
4/6/19,us stockswall street rises as jobs data allay economic concerns 20190
4/5/19,stock market news for apr 5 2019 
4/5/19,g iii smart boeing spirit and heico highlighted as zacks bull and bear of the day 
4/5/19,us stocks on the movedow boston beer lyft snap homebuilders 20190
4/5/19,huntington ingalls wins navy deal to support uss columbus 
4/5/19,the zacks analyst blog highlights boeing american airlines southwest and united 
4/5/19,bereaved families blame boeing after ethiopia crash report 20190
4/5/19,us stocks on the movedow lyft boston beer trovagene 20190
4/5/19,wall street rises on jobs data trade optimism 20190
4/5/19,us stockswall street rises on jobs data trade optimism 20190
4/5/19,why boeing stock slumped 13 in march 
4/5/19,boeing to provide end item equipment for fa 18 aircraft 
4/5/19,european shares firm irish stocks hit highest close in six months 20190
4/5/19,us stocks on the movedow lyft snap aquabounty dell syros pharma 20190
4/5/19,boeing cutting 737 max production in wake of two deadly crashes 20190
4/5/19,boeing studies 737 max output slowdown among scenarios 20190
4/5/19,us stockswall street chugs higher on jobs data trade optimism 20190
4/5/19,wall street chugs higher on jobs data trade optimism 20190
4/5/19,jet crisis deepens lessors to deregister more planes over 10 days 20190
4/5/19,european shares quiet ahead of us jobs data 20190
4/5/19,lessors to jet airways plan to deregister many more planes in coming days 20190
4/5/19,european shares little changed before us jobs data 20190
4/5/19,how excess speed hasty commands and flawed software doomed an ethiopian airlines 737 max 20190
4/4/19,market close report nasdaq composite index closes at 789178 down 377 points 
4/4/19,close update dow leads us stock indexes thursday ahead of employment report 
4/4/19,5 top stock trades for friday boeing roku and constellation brands 
4/4/19,us stockssp 500 dow advance with trade talks in focus 20190
4/4/19,sp 500 dow advance with trade talks in focus 20190
4/4/19,sp 500 nudges up toward sixmonth high tech drags 20190
4/4/19,us stocks snapshotsp 500 nudges up toward sixmonth high tech drags 20190
4/4/19,ethiopia inquiry shows boeing max hurtling uncontrolled to disaster 20190
4/4/19,us stockssp 500 edges higher with trade talks in focus 20190
4/4/19,sp 500 edges higher with trade talks in focus 20190
4/4/19,dow movers wba dow 
4/4/19,us stocks on the movetesla boeing facebook shopify micron office depot 20190
4/4/19,us stockssp pauses with trade talks in focus nasdaq set to end 5day rally 20190
4/4/19,sp pauses with trade talks in focus nasdaq set to end 5day rally 20190
4/4/19,4 lucrative defense stocks to add to your portfolio now 
4/4/19,airbus net orders in the red by end of first quarter 20190
4/4/19,us stocks on the moveboeing tesla facebook constellation brands office depot 20190
4/4/19,pre market most active for apr 4 2019 nio tsla tnxp amd mu bti nok sgmo sqqq baba azn ba 
4/4/19,sp wavers with uschina trade talks in focus 20190
4/4/19,us stockssp wavers with uschina trade talks in focus 20190
4/4/19,pilots of doomed ethiopian airlines flight struggled for control as planes nose dipped 20190
4/4/19,us stockswall st inches higher on facebook boeing bounce trade talks in focus 20190
4/4/19,wall st inches higher on facebook boeing bounce trade talks in focus 20190
4/4/19,us stocks on the movetesla facebook micron roku office depot 20190
4/4/19,7 best stocks to buy to make a buck off air travel 
4/4/19,ethiopian crash report highlights sensors software leaves questions 20190
4/4/19,ethiopian crash report shows pilots wrestling with controls 20190
4/4/19,ethiopia urges boeing to review 737 max controls backs pilots 20190
4/4/19,ethiopia urges boeing to review controls backs pilots 20190
4/4/19,ethiopian crew followed procedures  first official crash report 20190
4/4/19,ethiopian report says crew followed procedures 20190
4/3/19,nasdaq composite index closes up 1978 points for the week rising for the 5th straight day 
4/3/19,sp nasdaq make it 5 in a row on tech strength 
4/3/19,boeing to provide support services to jdamljdam program 
4/3/19,boeing software reactivated before ethiopian crash 20190
4/3/19,us chip stocks surge on trade deal hopes wall street edges up 20190
4/3/19,us stocksus chip stocks surge on trade deal hopes wall street edges up 20190
4/3/19,us stocksrising trade hopes boost wall st send chip stocks soaring 20190
4/3/19,rising trade hopes boost wall st send chip stocks soaring 20190
4/3/19,notable etf inflow detected vug goog ba unp 
4/3/19,dow movers ba intc 
4/3/19,us stocks on the movechipmakers tesla boeing lyft raytheon tobacco stocks 20190
4/3/19,lululemon avon caterpillar and boeing highlighted as zacks bull and bear of the day 
4/3/19,chip index at record boosts wall st as trade hopes build 20190
4/3/19,us stockschip index at record boosts wall st as trade hopes build 20190
4/3/19,us stocks on the movetesla raytheon lyft gamestop moneygram chip stocks homebuilders 20190
4/3/19,us stockswall street rises as trade hopes build chip index hits record 20190
4/3/19,wall street rises as trade hopes build chip index hits record 20190
4/3/19,us stocks on the movelyft pge boeing raytheon gamestop chip stocks 20190
4/3/19,wall street rises on trade hopes chip stocks at record highs 20190
4/3/19,us stockswall street rises on trade hopes chip stocks at record highs 20190
4/3/19,us stocks on the movechipmakers gamestop blue apron advaxis fusion connect 20190
4/3/19,ethiopia to issue first boeing investigation report on thursday 20190
4/3/19,ethiopia to issue first boeing investigation report 20190
4/3/19,boeing software under scrutiny as ethiopia prepares crash report 20190
4/3/19,boeing software reengaged before ethiopian crash 20190
4/3/19,boeing system triggered repeatedly in ethiopian crash 20190
4/3/19,boeing software engaged repeatedly before crash 20190
4/3/19,norwegians ceo held good meetings with boeing regarding max 20190
4/3/19,uae to validate any boeing max fix before lifting airspace ban 20190
4/3/19,ethiopian airlines pilots initially used boeing emergency procedures before crash 20190
4/3/19,british airways looks to the us for profitable growth 
4/3/19,ethiopian airlines pilots followed boeings emergency procedures before crash 20190
4/3/19,ethiopian airlines pilots initially followed boeing procedures before crash 20190
4/2/19,4 airline stocks ready to take flight 
4/2/19,positive manufacturing numbers positions caterpillar and boeing as buys 
4/2/19,latam stocks winning streak ends as some investors cash out 20190
4/2/19,us senate panel reviewing whistleblower claims on aviation safety  panel chair 20190
4/2/19,top ranked growth stocks to buy for april 2nd 
4/2/19,air canada delays launch of seasonal routes due to boeing max grounding 20190
4/2/19,embraer in advanced talks to sell military plane to portugal executive 20190
4/2/19,us air force again halts deliveries of boeing kc46 tanker aircraft 20190
4/2/19,european stocks hit sixmonth high as automakers insurers gain 20190
4/2/19,ftse 100 at 6mnth high as brexitwounded pound lifts exporters 20190
4/2/19,chinas huge airbus order padded by old or incomplete deals 20190
4/2/19,us manufacturing sector stabilizing challenges remain 20190
4/2/19,airbus china order padded by old or incomplete deals 20190
4/2/19,air canada removes boeings 737 max from schedule until july 20190
4/2/19,12 dividend stocks that hedge funds love 
4/2/19,londons main share index up as brexit drag on pound benefits exporters 20190
4/2/19,european stocks rally stalls brexit impasse weighs 20190
4/2/19,ftse 100 enjoys 4day winning streak as oil companies gain 20190
4/2/19,singapore airlines grounds two 78710s citing rollsroyce engine problem 20190
4/2/19,singapore airlines grounds two 78710s after inspections of rollsroyce trent 1000 ten engines 20190
4/1/19,manufacturing rebound pushes asian shares to 7month highs 20190
4/1/19,manufacturing rebound lifts asian shares to 7month highs 20190
4/1/19,asian shares rise to 7month high on us china manufacturing rebound 20190
4/1/19,boeing to submit 737 max software upgrade in the coming weeks 20190
4/1/19,us faa says it expects to receive boeing software fix over coming weeks 20190
4/1/19,us faa says it expects to receive boeing software fix over the coming weeks 20190
4/1/19,should you buy boeing stock now 
4/1/19,boeing secures 71m deal to support tav 8b harrier aircraft 
4/1/19,stock market news for apr 1 2019 
4/1/19,defense stock roundup boeing huntington ingalls lockheed martin score big wins 
4/1/19,us stockswall street rallies on upbeat manufacturing data 20190
4/1/19,wall street rallies on upbeat manufacturing data 20190
4/1/19,easyjet summer clouded by brexit and economic weakness 20190
4/1/19,ethiopia not planning plane crash announcement on monday 20190
4/1/19,ethiopian crash could be largest nonwar aviation reinsurance claim willis re 20190
4/1/19,no ethiopia plane crash report on monday maybe this week 20190
4/1/19,ethiopia set to release preliminary report into boeing 737 max crash 20190
4/1/19,saudi ban on boeing max flights to continue for near future 20190
4/1/19,boeing 737 max flights to remain banned in saudi for near future 20190
3/31/19,regulators knew before crashes that 737 max trim control was confusing in some conditions 20190
3/31/19,why the air force wants to buy boeings aging fighter 
3/30/19,strongest quarter since 2009 for sp 
3/30/19,general dynamics to provide support services to abrams system 
