Date,BA
3/13/2019,wall street sees upbeat open despite brexit and boeing turmoil 
3/13/2019,wednesdays vital data boeing home depot and advanced micro devices 
3/13/2019,wall street lifted by latest benign inflation data 20190
3/13/2019,us stockswall street lifted by latest benign inflation data 20190
3/13/2019,hopes britain will reject nodeal brexit buoy europe inditex slides 20190
3/13/2019,textron inc txt ex dividend date scheduled for march 14 2019 
3/13/2019,canada grounds boeing 737 max 8 and 9 jets citing safety concerns 20190
3/13/2019,canada grounds boeing 737 max 8 and 9 jets cites safety concerns 20190
3/13/2019,pre market most active for mar 13 2019 foxav acb pdd nok sqqq qqq ba tvix roku snn nio au 
3/13/2019,us stocks on the moveboeing tesla aurora cannabis cvs health rite aid 20190
3/13/2019,us futures cautiously higher amid brexit and boeing turmoil 
3/13/2019,kayak soothes nervous boeing flyers with airplane search filter 20190
3/13/2019,northrop grumman to provide support services to triton uas 
3/13/2019,3 big stock charts for wednesday brown forman westrock and fifth third 
3/13/2019,wall street lifted by benign economic data gains in boeing 20190
3/13/2019,us stockswall street lifted by benign economic data gains in boeing 20190
3/13/2019,us stocks on the moverite aid tesla boeing cvs health 20190
3/13/2019,dear wall street dump the dow jones industrial average asap 
3/13/2019,us stockswall st gains after tame economic data boeing turns higher 20190
3/13/2019,wall st gains after tame economic data boeing turns higher 20190
3/13/2019,us stocks on the movetesla boeing rite aid cvs health corp 20190
3/13/2019,us stockswall st to open higher after economic data boeing turns higher 20190
3/13/2019,wall st to open higher after economic data boeing turns higher 20190
3/13/2019,norwegian air to seek compensation from boeing for max groundings 20190
3/13/2019,lufthansa orders 40 boeing 7879 and airbus a350900 longhaul planes 20190
3/13/2019,india wont take deliveries of boeing 737 max until safety concerns cleared 20190
3/13/2019,europe shares claw higher as investors hope uk rejects nodeal brexit 20190
3/13/2019,bull of the day boeing ba 
3/13/2019,us stocks on the moveboeing rite aid cvs health aurora cannabis 20190
3/13/2019,us stocksfutures flat amid brexit uncertainty boeing falls again 20190
3/13/2019,futures flat amid brexit uncertainty boeing falls again 20190
3/13/2019,european shares up on hopes britain will reject nodeal brexit 20190
3/13/2019,kayakcom says to filter travel searches by aircraft model 20190
3/13/2019,equity markets stymied by signs of slowdown brexit chaos 20190
3/13/2019,asia shares stumble sterling at mercy of yet another vote 20190
3/13/2019,cathay pacific reasonably optimistic on outlook after swinging to annual profit 20190
3/13/2019,cathay pacific posts profit after two years of losses rising airfares aid 20190
3/13/2019,boeing faces crisis with worldwide grounding of 737 max jetliners 20190
3/13/2019,us joins other nations in grounding 737 max jets after second crash 20190
3/13/2019,us grounds 737 max jets boeing shares fall again 20190
3/13/2019,germany will not look at crashed boeing 737 max black box canada grounds jets 20190
3/13/2019,canada grounds boeing 737 max jets following ethiopia crash 20190
3/13/2019,ethiopia crash pilot had inplane issues victims mourned 20190
3/13/2019,ethiopia black boxes bound for europe crash pilot had inplane issues 20190
3/13/2019,ethiopia crash pilot had control problems black boxes bound for europe 20190
3/13/2019,ethiopia sends boeing black boxes abroad norway airline wants compensation 20190
3/13/2019,ethiopia to send boeing black boxes abroad norway airline wants compensation 20190
3/13/2019,us will not suspend boeing 737 max planes discussion on black box analysis 20190
3/12/2019,asian shares drift lower sterling awaits its fate 20190
3/12/2019,south american nations evaluating shutting airspace to boeing 737 max telam news agency 20190
3/12/2019,big gold gets bigger with barrick 
3/12/2019,market close report nasdaq composite index closes at 759103 up 3297 points 
3/12/2019,close update us stocks post slight gains overall while boeing drags down dow 
3/12/2019,dow lags as boeings troubles intensify 
3/12/2019,asian shares subdued sterling awaits its fate 20190
3/12/2019,airlines turn to other jets to weather boeing 737 max storm 20190
3/12/2019,top stock picks for march 11 2019 
3/12/2019,tuesday sector laggards consumer products industrial 
3/12/2019,tuesdays etf movers xop ita 
3/12/2019,sp 500 nasdaq rise after inflation data boeing weighs on dow 20190
3/12/2019,us stockssp 500 nasdaq rise after inflation data boeing weighs on dow 20190
3/12/2019,why boeing stock dropped 67 today 
3/12/2019,this just in boeing stock downgraded 
3/12/2019,stock market news southwest sinks on boeing fears mercadolibre gets a paypal 
3/12/2019,big day for brexit cpi in line at 021 
3/12/2019,sp 500 nasdaq gain after tame inflation data boeing weighs on dow 20190
3/12/2019,us stockssp 500 nasdaq gain after tame inflation data boeing weighs on dow 20190
3/12/2019,stocks rise on tame us inflation dollar eases 20190
3/12/2019,sp 500 movers ffiv fcx 
3/12/2019,dow movers ba axp 
3/12/2019,why boeing stock will soar again soon 
3/12/2019,in line cpi data for february 
3/12/2019,big day for brexit cpi in line at 02 
3/12/2019,stock market news for mar 12 2019 
3/12/2019,tuesdays vital data boeing apple and nvidia 
3/12/2019,us stocks on the movealphabet tesla boeing stitch fix cocacola tobacco stocks 20190
3/12/2019,this is why boeing ba is a great dividend stock 
3/12/2019,perficient colgate palmolive boeing columbia sportswear and foot locker highlighted as zacks bull and bear of the day 
3/12/2019,us stockswall st rises after tame inflation supports patient fed boeing drags dow 20190
3/12/2019,wall st rises after tame inflation supports patient fed boeing drags dow 20190
3/12/2019,canada sees no reason to ground boeing 737 max 8 ready to act if need be 20190
3/12/2019,canada not grounding boeing 737 max 8 ready to act if new information emerges 20190
3/12/2019,pre market most active for mar 12 2019 akba momo sqqq nio sfix eric tvix ba dks nm adt acb 
3/12/2019,us stocks on the movetesla boeing stitch fix southwest airlines 20190
3/12/2019,us defense budget favors navy shipbuilding fewer boeing tanker jets 20190
3/12/2019,latam fx rises as inflation data hits the dollar stocks slide 20190
3/12/2019,canada not grounding boeing 737 max ready to act if new info emerges 20190
3/12/2019,wall st up as inflation data supports dovish fed boeing slips further 20190
3/12/2019,us stockswall st up as inflation data supports dovish fed boeing slips further 20190
3/12/2019,tame us inflation data helps stocks hurts dollar 20190
3/12/2019,us stocks on the movetesla boeing stitch fix cocacola 20190
3/12/2019,us stockswall st gains on benign inflation data boeing extends fall 20190
3/12/2019,wall st gains on benign inflation data boeing extends fall 20190
3/12/2019,uae aviation authority to collect data on ethiopian crash 20190
3/12/2019,uk caa suspends boeing 737 max from airspace after crash 20190
3/12/2019,inflation data lifts sp nasdaq futures boeing slips again 20190
3/12/2019,us stocksinflation data lifts sp nasdaq futures boeing slips again 20190
3/12/2019,slowing economy keeping us inflation under wraps 20190
3/12/2019,us will not suspend boeing 737 max planes after ethiopia crash 20190
3/12/2019,us will not ground boeing 737 max planes after ethiopia crash 20190
3/12/2019,eu suspends boeing 737 max flights us senators suggest similar move 20190
3/12/2019,eu suspends boeing 737 max flights after ethiopia crash 20190
3/12/2019,europeans join wave of boeing suspensions after ethiopia crash 20190
3/12/2019,europeans join wave of boeing suspensions trump frets 20190
3/12/2019,ethiopia crash brings wave of boeing suspensions trump anxious 20190
3/12/2019,britain joins boeing suspensions investigators probe ethiopia crash 20190
3/12/2019,global boeing fears grow families await ethiopia crash remains 20190
3/12/2019,futures slightly higher ahead of inflation data 20190
3/12/2019,us stocksfutures slightly higher ahead of inflation data 20190
3/12/2019,ethiopia crash bodies will take days to release 20190
3/11/2019,stock market today tesla plans price hikes pares store closures 
3/11/2019,market close report nasdaq composite index closes at 755806 up 14992 points 
3/11/2019,close update technology stocks lead market higher as boeing holds back gains for dow 
3/11/2019,stocks snap losing streak as tech soars 
3/11/2019,boeing ba shares cross 2 yield mark 
3/11/2019,ryanair ceo says no immediate action planned on 737 max orders 20190
3/11/2019,3 of the best stocks to trade for the week 
3/11/2019,brazil to sign accord with us on space technology next week 20190
3/11/2019,us says 737 max safe to fly after ethiopia crash boeing shares dip 20190
3/11/2019,us says 737 max safe to fly after ethiopia crash boeing shares dip 20190
3/11/2019,monday sector laggards precious metals aerospace defense stocks 
3/11/2019,us to mandate design changes on boeing 737 max 8 after crashes 20190
3/11/2019,us says boeing 737 max 8 airworthy but says boeing will make design changes 20190
3/11/2019,us says boeing 737 max 8 airworthy but will act on any safety concern 20190
3/11/2019,us stockswall st snaps fiveday losing streak despite boeings drop 20190
3/11/2019,wall st snaps fiveday losing streak despite boeings drop 20190
3/11/2019,stocks surge in broad rally treasury yields rise 20190
3/11/2019,mid day update us stocks surge while losses in boeing hold back dow gains 
3/11/2019,boeing stock falls on ethiopian airlines 737 max 8 crash 
3/11/2019,stock market news boeing falls on crash fears disney celebrates captain marvel 
3/11/2019,wall st climbs with tech boeing off days lows 20190
3/11/2019,us stockswall st climbs with tech boeing off days lows 20190
3/11/2019,stocks rise in broad rally treasury yields gain 20190
3/11/2019,retail sales improve in january 
3/11/2019,sp 500 movers ba wdc 
3/11/2019,dow movers ba aapl 
3/11/2019,mid morning market update markets mostly higher nvidia to buy mellanox technologies for 69b 
3/11/2019,us stocks on the moveboeing apple facebook mellanox nvidia 20190
3/11/2019,why shares of boeing fell friday morning 
3/11/2019,retail sales improve boeing ba weighs on dow 
3/11/2019,us stockstech leads wall street higher boeing pares losses 20190
3/11/2019,tech leads wall street higher boeing pares losses 20190
3/11/2019,wall street sees mixed open as boeing drags dow futures lower after jet crash in ethiopia 
3/11/2019,european shares rebound helped by bank merger talk 20190
3/11/2019,stocks rally worldwide treasury yields rise 20190
3/11/2019,us futures mixed boeing drags dow lower after jet crash in ethiopia 
3/11/2019,us stocks on the moveboeing facebook apple nvidia mellanox 20190
3/11/2019,us stockswall st lifted by tech shares heavyweight boeing pares losses 20190
3/11/2019,wall st lifted by tech shares heavyweight boeing pares losses 20190
3/11/2019,us stocksheavyweight boeing pressures dow while tech lifts sp  nasdaq 20190
3/11/2019,heavyweight boeing pressures dow while tech lifts sp  nasdaq 20190
3/11/2019,boeing bonds move wider following plane crash 20190
3/11/2019,dow drops at open as heavyweight boeing slides after plane crash 20190
3/11/2019,us stocks snapshotdow drops at open as heavyweight boeing slides after plane crash 20190
3/11/2019,us retail sales rebound but not enough to jolt slowing economy 20190
3/11/2019,us stocksdow to open sharply lower as heavyweight boeing slides after plane crash 20190
3/11/2019,dow to open sharply lower as heavyweight boeing slides after plane crash 20190
3/11/2019,us stocks on the moveboeing apple barrick gold corp 20190
3/11/2019,insurers face large claims after second boeing 737 max crash 20190
3/11/2019,global aerospace is lead insurer for boeing 20190
3/11/2019,us stocks on the moveboeing tesla mellanox technologies 20190
3/11/2019,sp nasdaq futures edge higher following lackluster week boeing pressures dow 20190
3/11/2019,us stockssp nasdaq futures edge higher following lackluster week boeing pressures dow 20190
3/11/2019,after ethiopia crash horror some nations ground boeing 737 max 8s 20190
3/11/2019,china indonesia ground boeing 737 max 8 fleets after ethiopia crash 20190
3/11/2019,china and indonesia halt boeing 737 max 8 after ethiopia crash 20190
3/11/2019,china and ethiopia halt boeing 737 max 8 after crash 20190
3/11/2019,boeing shares vanguard of the dow hit hard after second 737 max crash 20190
3/11/2019,boeing shares vanguard of the dow crushed after second 737 max crash 20190
3/11/2019,boeing shares down 10 pct after second 737 max crash 20190
3/11/2019,boeing shares down 11 pct after second 737 max crash 20190
3/11/2019,boeing shares down 10 pct after second crash involving 737 max 8 20190
3/11/2019,european shares steady helped by bank merger talk safran down 20190
3/11/2019,boeing shares fall after second deadly 737 max 8 crash 20190
3/11/2019,aerospace group safrans shares fall after ethiopian airlines crash 20190
3/11/2019,chinese carriers ethiopian airlines halt use of boeing 737 max 8 aircraft after crash 20190
3/11/2019,chinese carriers ethiopian airlines suspend use of boeing 737 max 8 aircraft after crash 20190
3/11/2019,china orders its airlines to suspend use of boeing 737 max 8 aircraft 20190
3/10/2019,china suspends commercial operations of boeing 7378 planes 20190
3/10/2019,boeings 737 max back in spotlight after second fatal crash 20190
3/10/2019,china orders its airlines to suspend use of boeing 737 max aircraft 20190
3/10/2019,ethiopian airlines flight crashes killing 157 20190
3/9/2019,kratos high tech drone takes flight 
3/9/2019,the top 3 dow stocks during the 10 year bull market 
3/9/2019,spacex proves its ready to return america to space 
3/8/2019,7 top stocks to buy from goldman sachs secret portfolio 
3/8/2019,is the boeing ba stock outpacing its aerospace peers this year 
3/8/2019,american outdoor brands aobc q3 earnings beat sales miss 
3/8/2019,semtech smtc to report q4 earnings whats in the offing 
3/8/2019,us stocks on the moveeventbrite banks oil stocks big lots exxon mobil dropcar 20190
3/8/2019,us stocks on the moveeventbrite banks big lots exxonmobil 20190
3/8/2019,us stockswall st drops on paltry jobs growth global slowdown worries 20190
3/8/2019,wall st drops on paltry jobs growth global slowdown worries 20190
3/8/2019,us stockswall st set to fall on weak jobs data global growth worries 20190
3/8/2019,elon musks spacex capsule splashes down off florida coast 20190
3/8/2019,wall st set to fall on weak jobs data global growth worries 20190
3/8/2019,futures fall on global growth concerns jobs data awaited 20190
3/8/2019,us stocksfutures fall on global growth concerns jobs data awaited 20190
3/8/2019,airbus shares fall after weak set of orders 20190
3/8/2019,jet airways planes to be redeployed if no restructure agreed this month  lessor 20190
3/7/2019,5 must see stock charts for friday boeing sp 500 canopy growth 
3/7/2019,3 market leading stocks to buy with red on the street 
3/7/2019,musks spacex capsule set to splash down friday after space station stop 20190
3/7/2019,boeing jets could be part of broad uschina trade deal 20190
3/7/2019,should you invest in the fidelity msci industrials index etf fidu 
3/7/2019,general dynamics rewards investors with 97 dividend hike 
3/7/2019,british engineer cobham intends to reinstate dividend 20190
3/6/2019,air lease says boeing signaling full speed ahead for midsized jet 20190
3/6/2019,notable wednesday option activity ba nflx goog 
3/6/2019,flir systems flir acquires endeavor robotic for 382m 
3/6/2019,the zacks analyst blog highlights boeing abbott paypal caterpillar and anthem 
3/6/2019,the zacks analyst blog highlights boeing starbucks procter amp gamble cisco and philip morris 
3/6/2019,lockheed martin wins 946m support deal for saudis thaad 
3/6/2019,5 things kratos defense security wants you to know about 2019 
3/6/2019,ryanair eyes airbus for laudamotion boeing max 10 for main fleet 20190
3/5/2019,heres why boeing ba stock looks like a strong buy right now 
3/5/2019,top analyst reports for boeing abbott paypal 
3/5/2019,medifast eldorado resorts salesforce boeing starbucks and wpp highlighted as zacks bull and bear of the day 
3/5/2019,is boeing stock bound to slump after long term success 
3/5/2019,stock market news for mar 5 2019 
3/5/2019,tuesdays vital data salesforce boeing and exxon mobil 
3/5/2019,5 high yield blue chip stocks to withstand market turmoil 
3/5/2019,delta dangles future order for 200 jets considering alitalia investment 20190
3/5/2019,delta plans fleet overhaul considering alitalia investment 20190
3/5/2019,delta plans big fleet overhaul while still considering alitalia 20190
3/5/2019,southwest says mechanics disruption costing millions weekly 20190
3/5/2019,southwest says recent mechanics disruption costing millions weekly 20190
3/4/2019,us south korea to cut drills will it hurt defense stocks 
3/4/2019,general dynamics wins 14b deal to support stryker vehicles 
3/4/2019,heres why the initial 2020 pentagon funding plan is doa 
3/4/2019,sampp 500 closes above 2800 after nearly 4 months 5 picks 
3/4/2019,germany in talks with airbus on 600 mln euros of a380 loans 20190
3/4/2019,wall street rises on optimism over uschina trade progress 20190
3/4/2019,us stockswall street rises on optimism over uschina trade progress 20190
3/4/2019,wall st set to open higher as hopes of uschina trade deal rise 20190
3/4/2019,us stockswall st set to open higher as hopes of uschina trade deal rise 20190
3/4/2019,futures up on growing hopes of uschina trade deal 20190
3/4/2019,us stocksfutures up on growing hopes of uschina trade deal 20190
3/4/2019,eyes on the sea companies compete for australian maritime surveillance contract 20190
3/3/2019,look out kratos boeing just unveiled its own wingman drone 
3/2/2019,spacex rocket with unmanned us capsule blasts off for space station 20190
3/1/2019,five years on mh370 families band together to seek closure 20190
3/1/2019,southwest airlines readies hawaii flights in west coast push 20190
3/1/2019,us air force grounds boeings kc46 tankers over debris issue 20190
3/1/2019,spacex to launch capsule to space station in key milestone 20190
3/1/2019,jet airways founder agrees to step down sources say shares rise 20190
2/28/2019,jet airways shares rise after report of chairman stepping down 20190
