Date,BA
3/30/19,european stocks rise clocking best quarter in 4 years 20190
3/30/19,lockheed martin secures 11b deal for gmlrs production 
3/30/19,ftse 100 gains as trade progress offsets latest brexit setback 20190
3/30/19,dow 30 stock roundup apple launches new services jpmorgan to trim wealth jobs 
3/29/19,should you invest in the fidelity msci industrials index etf fidu1 
3/29/19,boeing stock has taken its lumps and still is a better buy than airbus 
3/29/19,southwest airlines stock will bottom out very soon 
3/29/19,china southern china eastern airlines post annual losses on fuel costs weak yuan 20190
3/29/19,no call for simulators in new boeing 737 max training proposals 20190
3/29/19,european stocks advance on uschina trade optimism hm boost 20190
3/29/19,sinous trade hopes lift ftse 100 profit warning yanks tui lower 20190
3/29/19,sinous trade hopes lift ftse 100 tui slumps 20190
3/29/19,european stocks higher on trade optimism hm surges 20190
3/29/19,china southern airlines sinks to annual losses on fuel costs weak yuan 20190
3/29/19,cost of boeing groundings rises as tui takes 200 mlnplus hit 20190
3/29/19,investigators believe antistall system activated in ethiopian crash 20190
3/29/19,regulators knew before crashes that 737 max trim control was confusing in some conditions 20190
3/28/19,noteworthy thursday option activity titn wbc ba 
3/28/19,aerion designing supersonic jet to run completely on biofuels 20190
3/28/19,heres why you should short boeing stock today 
3/28/19,us lawsuit filed against boeing over ethiopian airlines crash 20190
3/28/19,buffett says apple content plan hard to predict touts airline safety 20190
3/28/19,raytheon to provide support services to radar program systems 
3/28/19,company news for mar 28 2019 
3/28/19,why boeing ba is a great dividend stock right now 
3/28/19,wto says us failed to halt state tax subsidy for boeing 20190
3/28/19,southwest airlines cuts its forecast again but the pain is almost over 
3/28/19,vietnams bamboo airways to buy 50 airbus a321neo planes 20190
3/28/19,wto says us failed to withdraw state tax break for boeing 20190
3/28/19,vietnams bamboo airways signs firm deal to buy 50 airbus a321neo planes 20190
3/28/19,austrias facc proposes dividend hike despite profit drop 20190
3/28/19,us stocksfutures muted with uschina trade negotiations in focus 20190
3/28/19,futures muted with uschina trade negotiations in focus 20190
3/27/19,market close report nasdaq composite index closes at 764338 down 4814 points 
3/27/19,stocks settle choppy session lower 
3/27/19,raytheon wins deal to offer apy 10 radar kits for p 8a jets 
3/27/19,boeing unveils 737 max software fix after fatal crashes 20190
3/27/19,huntington ingalls secures 147b deal to construct lpd 30 
3/27/19,boeing rolls out software fix to defend 737 max franchise awaits us regulators approval 20190
3/27/19,boeing rolls out software fix to defend 737 max franchise 20190
3/27/19,boeing to make safety feature standard on 737 max 20190
3/27/19,us transport chief questions boeing decisions on 737 max safety features 20190
3/27/19,us transport chief asks why some boeing safety features not included 20190
3/27/19,us transport chief questionable why some boeing safety features not required 20190
3/27/19,us stockswall st set to open flat as global growth fears persist 20190
3/27/19,wall st set to open flat as global growth fears persist 20190
3/27/19,futures edge lower as growth worries linger 20190
3/27/19,us stocksfutures edge lower as growth worries linger 20190
3/27/19,southwest trims firstquarter outlook after 737 max groundings 20190
3/27/19,southwest trims first quarter outlook after 737 max groundings 20190
3/27/19,southwest cuts forecast for revenue performance measure after 737 max groundings 20190
3/27/19,china agrees to buy a boatload of airbus planes 
3/26/19,boeing ba stock sinks as market gains what you should know 
3/26/19,airbus secures 35b deal from china boeings loss rises 
3/26/19,xli ba mmm unp etf outflow alert 
3/26/19,company news for mar 26 2019 
3/26/19,is the boeing ba stock outpacing its aerospace peers this year1 
3/26/19,faa to overhaul air safety oversight by july  us inspector general 20190
3/26/19,is nasa preparing to cancel its space launch system 
3/26/19,boeing and lockheeds futuristic helicopter is finally airborne 
3/26/19,wall st moves higher on tech financials boost 20190
3/26/19,us stockswall st moves higher on tech financials boost 20190
3/26/19,boeing fix will prevent repeated activation of antistall system 20190
3/26/19,us to overhaul air safety oversight in response to two boeing 737 max crashes 20190
3/26/19,us aviation agency to overhaul oversight after boeing crashes 20190
3/26/19,ethiopian crash report likely to be released this week 20190
3/26/19,us stockswall street set for higher open after two days of losses 20190
3/26/19,wall street set for higher open after two days of losses 20190
3/26/19,china not taking boeing 737 max 8 airworthiness certificate applications 20190
3/26/19,us stocksfutures edge higher after two sessions of declines 20190
3/26/19,futures edge higher after two sessions of declines 20190
3/26/19,airbus shares take off after bumper beijing order 20190
3/26/19,ethiopian crash report likely to be released this week as boeing briefs airlines 20190
3/26/19,airbus shares rally after large chinese order 20190
3/26/19,preliminary report on ethiopian airlines crash very likely released this weektransport ministry 20190
3/25/19,market close report nasdaq composite index closes at 763754 down 513 points 
3/25/19,stocks drop as apple weighs after streaming event 
3/25/19,ba stock remains a strong buy as ethiopian airlines backs boeing 
3/25/19,sp 500 slips with apple lingering fears on global growth 20190
3/25/19,us stockssp 500 slips with apple lingering fears on global growth 20190
3/25/19,5 dow jones stocks for the end of muellers investigation 
3/25/19,bell boeing jv wins navy deal to boost v 22 tiltrotor program 
3/25/19,us stockswall st falls with apple lingering global growth fears 20190
3/25/19,wall st falls with apple lingering global growth fears 20190
3/25/19,us panel to review how airplanes certified after boeing 737 crashes 20190
3/25/19,airbus wins china order for 300 jets as xi visits france 20190
3/25/19,dow movers mcd ba 
3/25/19,company news for mar 25 2019 
3/25/19,us stocks on the moveviacom akamai technologies avaya recro pharma 20190
3/25/19,wall st falls on global growth worries 20190
3/25/19,us stockswall st falls on global growth worries 20190
3/25/19,airbus close to signing aircraft deal with china 20190
3/25/19,wall st ekes out gains global growth worries linger 20190
3/25/19,us stockswall st ekes out gains global growth worries linger 20190
3/25/19,us stocks on the moveviacom akamai technologies kohls curis recro pharma 20190
3/25/19,wall st falls on global economic slowdown fears 20190
3/25/19,us stockswall st falls on global economic slowdown fears 20190
3/25/19,us stocks on the moveviacom avaya akamai curis nu skin 20190
3/25/19,wall st set to open modestly lower as global growth fears persist 20190
3/25/19,us stockswall st set to open modestly lower as global growth fears persist 20190
3/25/19,qatar airways backs boeing despite max crash crisis 20190
3/25/19,ethiopian airlines commits to boeing ties despite flight 302 crash questions 20190
3/25/19,qatar airways ceo has confidence in boeing airplanes after max crash 20190
3/25/19,ethiopian airlines ceo promises to find out why flight 302 crashed 20190
3/25/19,boeing readies 737 max software fix as families wait for crash report 20190
3/25/19,boeing to brief on 737 max updates as ethiopian backs planemaker 20190
3/25/19,boeing sets briefing on 737 max as ethiopian carrier expresses confidence in planemaker 20190
3/25/19,boeing invites pilots regulators to briefing as it looks to return 737 max to service 20190
3/24/19,ethiopian airlines questions boeings aggressive software 20190
3/23/19,us lawmaker seeks boeing whistleblowers some max 737 orders in jeopardy 20190
3/23/19,some boeing 737 max orders in jeopardy us pilots try software fix 20190
3/23/19,us stockswall st tumbles on global economic slowdown fears 20190
3/23/19,wall st tumbles on global economic slowdown fears 20190
3/23/19,boeing wins 4b deal for delivery of fa 18 jets to us navy 
3/23/19,stock market news nike slips boeing faces cancellations 
3/23/19,us stockswall st stumbles as investors spooked by signs of economic slowdown 20190
3/23/19,wall st stumbles as investors spooked by signs of economic slowdown 20190
3/23/19,the zacks analyst blog highlights boeing lockheed martin and textron 
3/23/19,indonesian airline cancels boeing 737 max order american pilots to test software fix 20190
3/22/19,us stocks on the movetesla ge nike southwest airlines biogen 20190
3/22/19,defense stock roundup gd ba lmt win big deals air beats on q3 earnings 
3/22/19,general dynamics gd nassco wins 465m deal for cvn carrier 
3/22/19,curtis wright gains on high growth prospects amid debt woes 
3/22/19,dow 30 stock roundup aapl refreshes product lineup ba wins 327m navy order 
3/22/19,us stocks on the movenike biogen best buy tesla boeing 20190
3/22/19,confusion grief as hunt for remains from ethiopia crash halted 20190
3/22/19,us stocks on the movenike tesla boeing papa johns 20190
3/22/19,indias spicejet in talks with lessors to induct aircraft 20190
3/22/19,indonesian airline cancels boeing order citing passenger fear 20190
3/22/19,boeing makes safety change indonesian airline cancels order 20190
3/22/19,boeing to mandate safety feature in max software upgrade 20190
3/22/19,suspicion and strife strain ethiopian plane crash probe 20190
3/22/19,us corporate breakups could be catalyst to change dow index 20190
3/21/19,buy boeing and other aerospace defense stocks despite trade war pull back 
3/21/19,notable thursday option activity ba regn ea 
3/21/19,us stocks on the movebiogen apple conagra chipmakers 20190
3/21/19,us stocks on the movebiogen apple conagra 20190
3/21/19,boeing to mandate safety alert in 737 max software upgrade 20190
3/21/19,us stocks on the movebiogen guess apple micron 20190
3/21/19,us stocks on the movebiogen guess spi energy 20190
3/21/19,us stockswall st set for lower open after feds abrupt dovish turn 20190
3/21/19,wall st set for lower open after feds abrupt dovish turn 20190
3/21/19,us stocks on the moveguess inc micron technology steelcase inc 20190
3/21/19,futures tread water after fed turns more accommodative 20190
3/21/19,us stocksfutures tread water after fed turns more accommodative 20190
3/21/19,pilots searched for right checklist before lion air crash  investigators 20190
3/21/19,pilots searched for checklist before lion air crash  indonesian investigators 20190
3/21/19,ethiopia crash captain did not train on airlines max simulator 20190
3/21/19,ethiopian crash captain untrained on 737 max simulator 20190
3/21/19,indonesias lion air in early stages of longdelayed ipo 20190
3/21/19,will boeings problems spell trouble for ge aviation 
3/21/19,boeing to offer safety feature as standard in 737 max software upgrade 20190
3/21/19,world wants answers from indonesia and ethiopia crashes 20190
3/21/19,indonesia seeks answers as ethiopian crash comparisons mount 20190
3/21/19,boeing faa face more pressure from us lawmakers over 737 max accidents 20190
3/20/19,boeing delays by months test flights for us human space program 20190
3/20/19,boeing delays flight test to international space station 20190
3/20/19,boeing faa officials called to testify in us senate on 737 max plane crashes 20190
3/20/19,boeing faces growing pressure in washington over 737 max crashes 20190
3/20/19,analyst buy boeing because its too big to fail 
3/20/19,boeing ba secures 327m navy deal to upgrade p 8a aircraft 
3/20/19,raytheon to provide support services to essm block 2 program 
3/20/19,dow movers unh ba 
3/20/19,us stocks on the movefedex tencent music carmakers 20190
3/20/19,with 737 max grounded airlines face daily scheduling challenges 20190
3/20/19,us stocks on the movegeneral mills fedex ups nevro tencent music 20190
3/20/19,lion air pilots scoured handbook in minutes before crash 20190
3/20/19,indonesia crash revelations raise pressure on ethiopia investigation 20190
3/20/19,us stocks on the movefedex general mills ups nevro tencent music 20190
3/20/19,boeing names leadership for new joint venture with embraer 20190
3/20/19,us stocks on the movegeneral mills fedex ups motif bio 20190
3/20/19,stakes rise for boeing as eu canada step up scrutiny of 737 max after crashes 20190
3/20/19,indonesia crash revelations raise pressure on ethiopia probe 20190
3/20/19,spicejet in talks to lease some of jet airways grounded planes 20190
3/20/19,cockpit voice recorder of doomed lion air jet depicts pilots frantic search for fix 20190
3/19/19,boeing ba gains as market dips what you should know 
3/19/19,5 dow jones stocks coming to life 
3/19/19,warning signs for facebook uncertainty for boeing 
3/19/19,us stockswall street inches higher as fed meeting convenes 20190
3/19/19,wall street inches higher as fed meeting convenes 20190
3/19/19,stock market news for mar 19 2019 
3/19/19,top us trade officials head to china next week for new trade talks 20190
3/19/19,general dynamics gd wins 2b submarine modification deal 
3/19/19,embraer stock can keep rising despite q4 loss 
3/19/19,transport canada sending team to assist with proposed software changes for 737 max 20190
3/19/19,german military helicopters get mandatory funding in budget plan 20190
3/19/19,focuslenders and travellers stick with ethiopian airlines for now 20190
3/19/19,us stockswall street set for higher open as fed expected to hold fire 20190
3/19/19,wall street set for higher open as fed expected to hold fire 20190
3/19/19,futures higher as fed kicks off policy meeting 20190
3/19/19,us stocksfutures higher as fed kicks off policy meeting 20190
3/19/19,stakes rise for boeing as eu canada step up scrutiny of 737 max after crashes 20190
3/19/19,stakes rise for boeing as eu canada step up scrutiny 20190
3/19/19,highstakes boeing inquiry hinges on ethiopia black box secrets 20190
3/19/19,ethiopian crash crews voices may unlock highstakes boeing inquiry 20190
3/19/19,ethiopian crash crews voices could unlock highstakes boeing inquiry 20190
3/18/19,stock market today fis and worldpay merge to create payments giant 
3/18/19,close update us stocks start week with slim advance as traders await fomc meeting 
3/18/19,market close report nasdaq composite index closes at 771448 up 2595 points 
3/18/19,top stock picks for the week of mar 18 2019 
3/18/19,dow manages a win ahead of fed 
3/18/19,canada reexamining boeing 737 max approval after faa certification probe 20190
3/18/19,embraer ceo to step down ahead of deal with boeing 20190
3/18/19,us stockswall st advances ahead of fed policy meeting 20190
3/18/19,wall st advances ahead of fed policy meeting 20190
3/18/19,mid day update us stocks little changed monday ahead of fed meeting this week 
3/18/19,embraers ceo to step down following shareholder approval of boeing deal 20190
3/18/19,us stocks little changed monday as dow weighed down by boeing 
3/18/19,boeing ba secures 250m deal to support lrso cruise missile 
3/18/19,xli ba unp mmm large inflows detected at etf 
3/18/19,slow week of economic data boeing ba gets subpoena1 
3/18/19,wall st inches higher ahead of fed policy meeting 20190
3/18/19,us stockswall st inches higher ahead of fed policy meeting 20190
3/18/19,weak economic data weighed on the markets 
3/18/19,dow movers ba gs 
3/18/19,why boeing stock isnt a buy until we know more 
3/18/19,slow week of economic data boeing ba gets subpoena 
3/18/19,stock market news for mar 18 2019 
3/18/19,us stocks on the moveboeing tesla facebook apple 20190
3/18/19,weekly market summary us stocks rebound despite boeing and brexit drag 
3/18/19,mondays vital data aurora cannabis oracle and microsoft 
3/18/19,us stockswall st treads water as boeing facebook weigh fed meeting on tap 20190
3/18/19,wall st treads water as boeing facebook weigh fed meeting on tap 20190
3/18/19,westjet suspends 2019 forecasts after boeing groundings 20190
3/18/19,northrop grumman wins 45m navy deal to support lcs program 
3/18/19,wall street sees narrowly mixed open dow under pressure on boeing jet probe 
3/18/19,westjet suspends 2019 financial forecast after boeing groundings 20190
3/18/19,3 stocks to buy at a discount 
3/18/19,us futures narrowly mixed dow under pressure on boeing jet probe 
3/18/19,southwest airlines 737 max woes could help these 2 rivals 
3/18/19,pre market most active for mar 18 2019 lptx derm acb nihd nio wp nok ba phas fis sqqq czr 
3/18/19,us stocks on the moveedwards lifesciences boeing apple worldpay facebook 20190
3/18/19,us stockstech boosts wall street boeing keeps dow in check 20190
3/18/19,tech boosts wall street boeing keeps dow in check 20190
3/18/19,data shows angle of attack similar in boeing 737 crashes 20190
3/18/19,us stocks on the moveboeing facebook dare bioscience 20190
3/18/19,wall street lifted by tech stocks boeing drags on dow 20190
3/18/19,us stockswall street lifted by tech stocks boeing drags on dow 20190
3/18/19,futures flat following best weekly rally of 2019 boeing drags on dow 20190
3/18/19,us stocksfutures flat following best weekly rally of 2019 boeing drags on dow 20190
3/18/19,us stocks on the moveboeing worldpay dermira facebook 20190
3/18/19,ethiopia and indonesia crash parallels heap pressure on boeing 20190
3/18/19,pressure rises on boeing over ethiopia indonesia crash parallels 20190
3/18/19,boeing faces growing scrutiny in ethiopian crash probe 20190
3/18/19,tsx futures flat as focus shifts to fed meeting 20190
3/18/19,us stocks on the moveboeing caesars entertainment worldpay 20190
3/18/19,futures tick higher after best week of the year boeing weighs on dow 20190
3/18/19,us stocksfutures tick higher after best week of the year boeing weighs on dow 20190
3/18/19,swiss re says helped insure boeing ethiopian airlines 20190
3/18/19,boeing shares fall again after probe report into faa approval of 737 max 20190
3/18/19,deutschecommerzbank merger talk brightens mood for european stocks 20190
3/18/19,ethiopia says crashed jets black boxes show similarities to lion air disaster 20190
3/18/19,ethiopia says crashed jets black boxes show similarities to lion air mishap 20190
3/18/19,ethiopia says crash black boxes show similarities to lion air accident 20190
3/18/19,us transportation dept probes faa approval of 737 max 20190
3/18/19,yieldcos for any investor 
3/18/19,boeing says finalizing software upgrade revising pilot training for 737 max 20190
3/17/19,ethiopian airlines black boxes show similarities to lion air crash 20190
3/17/19,lufthansa buys boeings 787 dreamliner and orders more airbus a350s 
3/17/19,the navy is getting serious about crewless vessels 
3/16/19,airbus order book shrank again in february 
3/16/19,3 international companies making waves in the us 
3/16/19,trade tech spark risk on session for stocks 